,title,job_role,companyName,job_location,Job_Summary,post_date,salary,today_date,Job_url
132,Development Operations Engineer,Machine Learning Engineer,Infor,+1 locationRemote,"Collaborate with other DevOps engineers.
You’ll need to have strong experience in Amazon Web Services.
You will be engaging with development teams, providing…",PostedPosted 21 days ago,?,2023-08-30,https://in.indeed.com/rc/clk?jk=da2b9885811a8ce8&fccid=ddf188c30da34688&vjs=3
133,Azure Data Engineer,Machine Learning Engineer,Amazatic Solutions LLP,"Remote in Pune, Maharashtra",A data engineer will possess both programming and data management skills and can complete data projects from end to end where required.,PostedPosted 13 days ago,"₹10,30,682 - ₹25,91,899 a year",2023-08-30,https://in.indeed.com/company/Amazatic-Solutions/jobs/Data-Engineer-604e79333582c493?fccid=86aa520f66376ed6&vjs=3
134,Data Science Online Trainer,Machine Learning Engineer,Prognoz,Remote,"1+ year experience in Data Science.
Must have worked on minimum 2 Data Science Projects and must have at least 50 hours experience in online training on Data…",PostedPosted 30+ days ago,?,2023-08-30,https://in.indeed.com/rc/clk?jk=627cad5cd3adc60c&fccid=d3c16ab1f2de3595&vjs=3
135,Associate Engineer - Aerodynamics,Machine Learning Engineer,Airbus,"Bengaluru, Karnataka","➢ Overall understanding of data analytics, Machine learning.
Designing and developing the aircraft of the future paving the way for decarbonized aviation.",PostedPosted 30+ days ago,?,2023-08-30,https://in.indeed.com/rc/clk?jk=12c2097ced529f35&fccid=2d0740e02e80cf22&vjs=3
136,Deep Learning Engineer,Machine Learning Engineer,RadiusAI,"Bengaluru, Karnataka","Experience in data-driven problem-solving and the deployment of machine learning models.
We are currently looking to hire data scientist with experience in…",PostedPosted 30+ days ago,?,2023-08-30,https://in.indeed.com/rc/clk?jk=317342ebe865a281&fccid=27daef40efcb05a3&vjs=3
137,Junior Data Scientist Bangalore,Machine Learning Engineer,Datawrkz,"Bengaluru, Karnataka","Implementation of machine learning algorithms for predictive modeling.
Basic understanding of popular machine learning models commonly used with tabular data,…",PostedPosted 16 days ago,?,2023-08-30,https://in.indeed.com/rc/clk?jk=3e1ab9b4353a09f0&fccid=014a57859065e0f0&vjs=3
138,Silicon Engineer - Internship Opportunities,Machine Learning Engineer,Microsoft,India,"We are responsible for building & delivering the overall design system which includes the foundational automation, software solutions, methodology &…",PostedPosted 9 days ago,?,2023-08-30,https://in.indeed.com/rc/clk?jk=bc324b475ad00aaf&fccid=734cb5a01ee60f80&vjs=3
139,Machine Learning,Machine Learning Engineer,Harman International,"Bengaluru, Karnataka","Basic knowledge of image processing , machine-learning would be good to have.
The main responsibility is to create quality datasets to make the deep learning…",PostedPosted 18 days ago,?,2023-08-30,https://in.indeed.com/rc/clk?jk=bbb5ea3536764640&fccid=4faf342d2307e9ed&vjs=3
140,ML Engineer,Machine Learning Engineer,SBCS India,"Bengaluru, Karnataka","Experience working with machine learning frameworks like Tensor flow, Caffe, etc.
Exposure to deep learning approaches and modeling frameworks (PyTorch, Tensor…",PostedPosted 30+ days ago,?,2023-08-30,https://in.indeed.com/rc/clk?jk=61c13fee34815a8e&fccid=24293c30ee60aeae&vjs=3
141,BI Specialist,Machine Learning Engineer,Razor Group GmbH,"Delhi, Delhi",You design and implement the full Data Science life-cycle: work closely with internal and external stakeholders to build instrumentation and define dimensional…,PostedPosted 30+ days ago,?,2023-08-30,https://in.indeed.com/rc/clk?jk=fe7c8c6bb1d8bf73&fccid=34e8af27bd7fec1f&vjs=3
142,Data Scientist (Machine Learning),Machine Learning Engineer,Helius Technologies,India,"You should have a passion for applied ML and AI, as well as an interest in learning new programming languages and technologies.",PostedPosted 30+ days ago,?,2023-08-30,https://in.indeed.com/rc/clk?jk=402e9894bcf0ea6d&fccid=b3282c125f18e0c0&vjs=3
143,Python Web Scraping,Machine Learning Engineer,Innefu Labs Pvt. Ltd.,"Delhi, Delhi","Working in cutting edge technologies - Using AI for predictive intelligence and Facial Biometrics.
Mine data from structured and unstructured data sources.",PostedPosted 30+ days ago,?,2023-08-30,https://in.indeed.com/rc/clk?jk=77691ea157b137eb&fccid=5c36da9694f987a9&vjs=3
144,Financial Planning Analyst,Machine Learning Engineer,Extuent Technologies Inc,"Remote in Gurgaon, Haryana","Develop and maintain financial models and forecasts for the company's various business units.
Analyze financial data and identify trends, risks, and…",EmployerActive 25 days ago,"₹25,00,000 - ₹30,00,000 a year",2023-08-30,https://in.indeed.com/company/Extuent-Technologies-Inc/jobs/Financial-Planning-Analyst-459d85b92c91ff37?fccid=f291a3ed1a3c27ee&vjs=3
145,"Machine Learning Engineer, Image Processing",Machine Learning Engineer,Hubino,"Chennai, Tamil Nadu","At-least 2-3 years of expertise in developing deep learning and processing algorithms which includes ETL.
Understanding business challenges, goals, constraints,…",PostedPosted 30+ days ago,?,2023-08-30,https://in.indeed.com/rc/clk?jk=f47f56b622163fd0&fccid=84a6e2b689b07b46&vjs=3
146,Machine Learning Sr. Engineer,Machine Learning Engineer,Ziniosedge,"Bengaluru, Karnataka","Familiarity with machine learning frameworks and libraries.
Experience as a Machine Learning Engineer.
Understanding of data structures, data modelling and…",PostedPosted 30+ days ago,?,2023-08-30,https://in.indeed.com/rc/clk?jk=9442373d065be56a&fccid=e6f006f8cf653747&vjs=3
147,Data Engineer,Machine Learning Engineer,Baazi Games,"Delhi, Delhi","Design, build and own all the components of a high-volume data warehouse end to end.
Build efficient data models using industry best practices and metadata for…",PostedPosted 30+ days ago,?,2023-08-30,https://in.indeed.com/rc/clk?jk=0691e33ef808acf2&fccid=1179bcbe0da672b3&vjs=3
148,Machine Learning Engineer,Machine Learning Engineer,AGEYE Technologies,"Bengaluru, Karnataka","At least 2 years of experience in machine learning and deep learning either in academic or industrial domain.
Position Type: Full-time – Permanent.",PostedPosted 30+ days ago,?,2023-08-30,https://in.indeed.com/rc/clk?jk=6bf3a73bea044bb2&fccid=9c8fd35a01febf0d&vjs=3
149,Machine Learning Engineer | SNDK CORP,Machine Learning Engineer,SNDK Corp,"Ahmedabad, Gujarat","Develop and implement machine learning models and algorithms to solve complex problems.
Experience with machine learning frameworks such as TensorFlow, PyTorch,…",PostedPosted 30+ days ago,?,2023-08-30,https://in.indeed.com/rc/clk?jk=c6d1995113aed1af&fccid=b458d9e47362e66f&vjs=3
150,AI/ML Engineer,Machine Learning Engineer,INFOBEANS TECHNOLOGIES,"Indore, Madhya Pradesh","Understanding of machine learning algorithms such as regression, classification, clustering, neural networks, and deep learning.",PostedPosted 9 days ago,?,2023-08-30,https://in.indeed.com/rc/clk?jk=80021966643ce45a&fccid=6e77da1f80b6c8c9&vjs=3
151,Associate Database Engineer,Machine Learning Engineer,Benchmark Gensuite,"Bengaluru, Karnataka","Benchmark Gensuite jobs play a crucial role in helping develop our unified EHS, Sustainability, and ESG digital transformation software solutions that enable…",PostedPosted 17 days ago,?,2023-08-30,https://in.indeed.com/rc/clk?jk=93983f8b2e37acc4&fccid=7761232c045d0f09&vjs=3
152,Junior Python Developer,Machine Learning Engineer,VTS infosoft pvt ltd,"Remote in Gautam Budh Nagar, Uttar Pradesh","Our expert consultants provide strategic consultation, implementation services, support and managed services.
UiPath, Automation Anywhere, or Blue Prism.",EmployerActive 2 days ago,"₹20,000 - ₹50,000 a month",2023-08-30,https://in.indeed.com/company/VTS-infosoft-pvt-ltd/jobs/Junior-Python-Developer-4b04e4d7af5770bb?fccid=cc4dfa37e544bd71&vjs=3
153,Python Engineer,Machine Learning Engineer,East India Securities,"Mumbai, Maharashtra","» 2+ years of experience working with python.
» Ability to churn scripting solutions with a quick turnaround time.",PostedPosted 30+ days ago,?,2023-08-30,https://in.indeed.com/rc/clk?jk=b0db98cf99b94b1f&fccid=ce80ed4e75722d68&vjs=3
154,Machine Learning Engineer,Machine Learning Engineer,Samyak Infotech,"Ahmedabad, Gujarat","Designing and programming machine learning methods and integrating them into our ML framework / pipeline.
Knowledge of machine learning libraries Tensorflow,…",PostedPosted 30+ days ago,?,2023-08-30,https://in.indeed.com/rc/clk?jk=ecc898b9ba5919c8&fccid=3e3eadc5efbd00f7&vjs=3
155,AI Engineer,Machine Learning Engineer,Waybeo Technology Solutions,"Thiruvananthapuram, Kerala","Solid understanding of machine learning concepts and algorithms.
Familiarity with machine learning frameworks such as TensorFlow or PyTorch or Scikit-learn.",EmployerActive 8 days ago,"₹50,000 - ₹1,00,000 a month",2023-08-30,https://in.indeed.com/company/Waybeo-Technology-Solutions/jobs/Engineer-20a15d3f3e5c1032?fccid=3414006a54c6a316&vjs=3
156,DevOps Engineer (1-2 year exp),Machine Learning Engineer,Eclat Engineering Pvt. Ltd.,"Remote in Ahmedabad, Gujarat",This Individual will have the challenging responsibility of channeling our IT infrastructure and offer customer services with stringent international standard…,EmployerActive 1 day ago,"₹5,00,000 - ₹8,00,000 a year",2023-08-30,https://in.indeed.com/company/Eclat-Engineering/jobs/Development-Operations-Engineer-88c693243e7d944e?fccid=756c4b426d1e74b3&vjs=3
157,Data Scientist,Machine Learning Engineer,Maan Source,"Delhi, Delhi","Knowledge of a variety of machine learning techniques (clustering, decision tree learning, artificial neural networks, etc.) and their real-world advantages/…",EmployerActive 2 days ago,"₹12,00,000 - ₹15,00,000 a year",2023-08-30,https://in.indeed.com/company/Maan-Source/jobs/Data-Scientist-ff0c84ca2a2a66b2?fccid=b8e00c022f23e543&vjs=3
158,Machine Learning Engineer,Machine Learning Engineer,Aera Technology,"Pune, Maharashtra","Good to have experience in working with large data sets and pipelines, and distributed systems for machine learning using frameworks.",PostedPosted 30+ days ago,?,2023-08-30,https://in.indeed.com/rc/clk?jk=085442418907d2d1&fccid=5fdf424b89e5fd4b&vjs=3
159,Machine Learning Engineer,Machine Learning Engineer,Siam Computing,"Chennai, Tamil Nadu","Collaborate with engineers to identify and solve complex business problems using machine learning.
Understanding of core machine learning concepts and…",PostedPosted 30 days ago,?,2023-08-30,https://in.indeed.com/rc/clk?jk=ae3ee00b26264f29&fccid=8d47337bf776b619&vjs=3
160,Machine Learning Engineer,Machine Learning Engineer,Mantras2Success consultants,"Hyderabad, Telangana",The company is a leading Fintech firm catering the need of underserved and unserved individuals using highly evolved machine learning tools.,PostedPosted 30+ days ago,"₹15,00,000 - ₹22,00,000 a year",2023-08-30,https://in.indeed.com/rc/clk?jk=20f30521933bbbf3&fccid=ceef42c635638fb6&vjs=3
161,Machine Learning Quant,Machine Learning Engineer,fionics (HIRECLOUT),"Bengaluru, Karnataka","Minimum, 2 year track record creating profitable Alpha strategies using Machine Learning.
Strong understanding of Python and modern ML tools like Scikit,…",PostedPosted 30+ days ago,?,2023-08-30,https://in.indeed.com/rc/clk?jk=4a15cb8ed2d0f5de&fccid=37cd0971f3cd9a3b&vjs=3
162,Junior Backend Engineer,Machine Learning Engineer,Hailify,Remote,"Backend Engineers primarily write server scripts and API's to be utilized by front side engineers and UX designers.
Write clean, scalable code using .",PostedPosted 9 days ago,?,2023-08-30,https://in.indeed.com/rc/clk?jk=13d9c78838bbd8f7&fccid=6200925e5e3e12bc&vjs=3
163,Artificial Intelligence/Machine Learning Engineer(0 to less than 2 years relevant experience),Machine Learning Engineer,SISL Infotech,India,Artificial Intelligence/Machine Learning Engineer(0 to less than 2 years relevant experience).,PostedPosted 30+ days ago,?,2023-08-30,https://in.indeed.com/rc/clk?jk=ac8d30c4c5645fbd&fccid=b5a3e80cea4426dc&vjs=3
164,Machine Learning & AI Online Trainer,Machine Learning Engineer,Prognoz,Remote,"1+ year experience in Machine Learning, Deep Learning, NLP field.
Must have worked on minimum 2 AI Projects and must have at least 50 hours experience in online…",PostedPosted 30+ days ago,?,2023-08-30,https://in.indeed.com/rc/clk?jk=a161ebf041cea397&fccid=d3c16ab1f2de3595&vjs=3
165,Deep Learning Engineer,Machine Learning Engineer,Evigway Technologies,"Gurgaon, Haryana","Research and work on DL models from the ground up, for new use cases, based on set business objectives; Evaluate different Machine Learning algorithms, Analyse…",PostedPosted 30+ days ago,?,2023-08-30,https://in.indeed.com/rc/clk?jk=ad5cf6746c20f9e1&fccid=a08893d3feb69100&vjs=3
166,Data Scientist,Machine Learning Engineer,Cendyn,"Gurgaon, Haryana","Strong knowledge of data mining and machine learning techniques such as decision tree (CHAID/CART), clustering, segmentation, association rules, etc.",PostedPosted 19 days ago,?,2023-08-30,https://in.indeed.com/rc/clk?jk=3202db261bbf44d6&fccid=904e9483c827415b&vjs=3
167,Machine Learning Data Associate (On Contract),Machine Learning Engineer,Observe.AI,"Bengaluru, Karnataka","AI maximizes agent performance, pinpoints new revenue and coaching opportunities, and up-levels quality assurance and compliance.",PostedPosted 30+ days ago,?,2023-08-30,https://in.indeed.com/rc/clk?jk=38e7d2c14fcca441&fccid=3b5529b0eb6070d8&vjs=3
168,Software Engineer Trainee,Machine Learning Engineer,Techbrawn IT Solution,"Gurgaon, Haryana","TECHBRAWN is a professional consulting organization, specialized in SAP solution integration and business process optimization with focus on the Retail industry…",EmployerActive 7 days ago,"₹3,00,000 - ₹3,60,000 a year",2023-08-30,https://in.indeed.com/company/Techbrawn-IT-Solution/jobs/Software-Trainee-0360818be69828e1?fccid=22e77852c5da3818&vjs=3
169,Data Analyst,Machine Learning Engineer,Digital Green,"Delhi, Delhi","Digital Green is seeking a results-oriented, innovative data analyst to drive DG transition to a more efficient and effective internal data management and…",PostedPosted 12 days ago,?,2023-08-30,https://in.indeed.com/rc/clk?jk=48f7504b7eb9c457&fccid=5493eab299fcc038&vjs=3
170,Data Science Engineer,Machine Learning Engineer,Tuebora,Remote,"Tuebora provides extensive medical, dental, and vision benefits to our employees and their families.
In addition, we offer generous holidays and vacation days…",PostedPosted 30+ days ago,?,2023-08-30,https://in.indeed.com/rc/clk?jk=f259d46c043ae61b&fccid=398e38859d8d682a&vjs=3
171,Machine Learning Engineer,Machine Learning Engineer,Zessta,"Hyderabad, Telangana","Designing and developing machine learning and deep learning systems according to the requirements.
Familiarity with machine learning frameworks (like Keras or…",PostedPosted 30+ days ago,?,2023-08-30,https://in.indeed.com/rc/clk?jk=b7cc643d10b2c9b2&fccid=458903876d9a6b30&vjs=3
172,Data Science - 51878295,Machine Learning Engineer,Sage IT India,India,"A Data Scientist is a proficient specialist who applies mathematical, problem-solving, and coding skills to manage big data, extracting valuable insights.",PostedPosted 30+ days ago,?,2023-08-30,https://in.indeed.com/rc/clk?jk=cbe2878c961b9407&fccid=159914c2b3cfd876&vjs=3
173,Python & AI/ML Developer,Machine Learning Engineer,Totality Corp,"Remote in Gurgaon, Haryana","Evaluate and refine existing machine learning models.
At least 2-3 production implementations of machine learning projects.",PostedPosted 12 days ago,?,2023-08-30,https://in.indeed.com/rc/clk?jk=8c228ba566aced85&fccid=1f8edc6c3ee7dd85&vjs=3
174,Data Analyst,Machine Learning Engineer,8848 Digital LLP,Remote in Remote,"Continuously improve data analysis skills and expand knowledge of statistical analysis, machine learning, and data visualization techniques.",PostedPosted 30+ days ago,"₹7,00,000 - ₹9,00,000 a year",2023-08-30,https://in.indeed.com/company/Nexcen-Global/jobs/Data-Analyst-71e2e9164f4c7878?fccid=8998e89e6dd8d44a&vjs=3
175,BI Engineer,Machine Learning Engineer,HB Health Solutions Pvt Ltd,"Pune, Maharashtra","As the BI Engineer will be responsible for architecting and implementing BI framework for reporting, auditing, monitoring and visualising various organisational…",PostedPosted 30+ days ago,"₹10,00,000 - ₹15,00,000 a year",2023-08-30,https://in.indeed.com/company/HB-Health-Solutions-Pvt-Ltd/jobs/Business-Intelligence-Developer-4632997253e6e152?fccid=b00905fc764908b6&vjs=3
176,Machine Learning Engineer,Machine Learning Engineer,Collinson,"Hybrid remote in Mumbai, Maharashtra",Collaborate with data scientists and engineers to deploy new machine learning and deep learning models into complex and mission critical production systems.,PostedPosted 30+ days ago,?,2023-08-30,https://in.indeed.com/rc/clk?jk=66c4d1e04e709b10&fccid=e95250d354b6a1c7&vjs=3
177,Data Engineer,Machine Learning Engineer,Litmus7,"Kochi, Kerala",We are looking for aspiring data engineers and data scientists who have learnt data engineering or data science by themselves or are beginners.,PostedPosted 30+ days ago,?,2023-08-30,https://in.indeed.com/rc/clk?jk=7c278aa5688beff2&fccid=1d1984970b1ebe81&vjs=3
178,Machine Learning Engineer 1,Machine Learning Engineer,Anuview,"Chennai, Tamil Nadu","In new product design roles: develops and programs integrated software algorithms to structure, analyze and leverage data in product and systems applications in…",PostedPosted 30+ days ago,?,2023-08-30,https://in.indeed.com/rc/clk?jk=0d21d90bc0190dfe&fccid=e5f32920c98e523d&vjs=3
179,Enabling Areas - AI/ML + Gen AI - DEC,Machine Learning Engineer,Deloitte,"Bengaluru, Karnataka","Experience applying statistical modelling, machine learning, NLP, and other quantitative techniques to solve business problems.",PostedPosted 14 days ago,?,2023-08-30,https://in.indeed.com/rc/clk?jk=dc2f56f33981a3fd&fccid=9e215d88a6b33622&vjs=3
180,Junior Python Developer,Machine Learning Engineer,Wisdomleaf Technologies (P) Limited,India,Responsibilities : Participate in requirement gathering and analysis activities Create sensible documentation for features that you develop Develop new features…,PostedPosted 30+ days ago,"₹3,00,000 - ₹4,00,000 a year",2023-08-30,https://in.indeed.com/rc/clk?jk=298089e9a99c56f2&fccid=91966216d300cee2&vjs=3
181,Python - AI/ML Engineer,Machine Learning Engineer,Nettyfy Technologies,"Ahmedabad, Gujarat","Strong knowledge of machine learning algorithms, statistical modelling, and data analysis techniques.
Model Deployment: Collaborate with software engineers and…",EmployerActive 2 days ago,"₹15,000 - ₹40,000 a month",2023-08-30,https://in.indeed.com/company/Nettyfy-Technologies/jobs/Python-Developer-510e8c47f2494a8f?fccid=efb80e21b807abe4&vjs=3
182,Report Developer (Remote),Machine Learning Engineer,Pluto7,Remote,"Pluto7 is a tech-enabled solutions and services company that ignites digital transformation providing supply chain solutions across industries such as Retail,…",PostedPosted 21 days ago,?,2023-08-30,https://in.indeed.com/rc/clk?jk=a4cc2c1f306c920a&fccid=303b7882c2847d78&vjs=3
183,Machine learning and AI Engineer,Machine Learning Engineer,Megdap Innovation Labs,"Pune, Maharashtra","Strong machine learning background and familiar with standard statistical modeling techniques applied to speech.
Experience with Open source NLP Libraries.",PostedPosted 30+ days ago,?,2023-08-30,https://in.indeed.com/rc/clk?jk=7ef03972075ce893&fccid=18176b7bf7d0b885&vjs=3
184,Generative AI Engineer,Machine Learning Engineer,Siemens Healthineers,"Bengaluru, Karnataka","Model Training and Evaluation: Train and fine-tune a Large Language Model (LLM) for code generation, using appropriate machine-learning frameworks and tools.",PostedPosted 25 days ago,?,2023-08-30,https://in.indeed.com/rc/clk?jk=08b7e8aadf156573&fccid=c5679bf29a1db253&vjs=3
185,Associate,Machine Learning Engineer,PwC,"Mumbai, Maharashtra+2 locations","Knowledge of a variety of machine learning techniques (clustering, decision tree learning, artificial.
We make impactful decisions by mixing mind and machine to…",PostedPosted 27 days ago,?,2023-08-30,https://in.indeed.com/rc/clk?jk=5d594152894e1ba9&fccid=5e964c4afc56b180&vjs=3
186,Machine Learning Specialist,Machine Learning Engineer,Xena Dx,"Thane District, Maharashtra","Implement and optimize machine learning algorithms for real-time and scalable deployment.
Strong foundation in machine learning (including deep learning)…",EmployerActive 9 days ago,"₹40,000 - ₹1,20,000 a month",2023-08-30,https://in.indeed.com/company/Xena-Dx/jobs/Machine-Specialist-c2e1bf1f95c34c92?fccid=b35c5e13d1f58eba&vjs=3
187,Data Engineer,Machine Learning Engineer,Objectways India Pvt. Ltd,"Pune, Maharashtra","The Data Analytics Engineer role is for an experienced individual who has demonstrated experience in building production-grade data pipelines, Deeper…",EmployerActive 6 days ago,"₹3,00,000 - ₹5,00,000 a year",2023-08-30,https://in.indeed.com/company/Objectways-India-Pvt.-Ltd/jobs/Data-Engineer-1a9d0a1360d39ab4?fccid=a761134c0efa3472&vjs=3
188,Lighthouse Pyspark Data Engineer,Machine Learning Engineer,KPMG,"Bengaluru, Karnataka","As a Pyspark Data Engineer, you will be responsible for designing, implementing, and maintaining data pipelines using Pyspark and other Big Data technologies.",PostedPosted 30+ days ago,?,2023-08-30,https://in.indeed.com/rc/clk?jk=049ed56be9696c6e&fccid=2dd390c3a48a7ed0&vjs=3
189,Data analysis Trainer,Machine Learning Engineer,Aspirevision tech education pvt. Ltd,"Delhi, Delhi","The ideal candidate should have a strong analytical mindset, exceptional data manipulation skills, and a proven track record of delivering high-impact business…",EmployerActive 10 days ago,"₹5,000 - ₹8,000 a day",2023-08-30,https://in.indeed.com/company/Aspirevision-tech-education-pvt.-Ltd/jobs/Trainer-4bf10729ab9e4ca6?fccid=02f818a9fbd92bcb&vjs=3
190,SDE II - Frontend,Machine Learning Engineer,BigShyft,"Gurgaon, Haryana","Working with Backend, Data Science and DevOps engineers for API implementation and design.
Ownership of key UI modules.
Own front-end build and test systems.",PostedPosted 12 days ago,"₹12,00,000 - ₹32,00,000 a year",2023-08-30,https://in.indeed.com/rc/clk?jk=0512437d54215979&fccid=df4303b9957be85e&vjs=3
191,Data Science Intern,Machine Learning Engineer,Brave AI Lab,India,"Hands-on experience and project-based learning in computer science, engineering, or mathematics are preferred.
Minimum 6 months of Experience in Python.",PostedPosted 30+ days ago,?,2023-08-30,https://in.indeed.com/rc/clk?jk=3d05dd5d02183025&fccid=f126c0eccc0e9a22&vjs=3
192,Data Engineer,Machine Learning Engineer,Brainfloss Private Limited,"Pune, Maharashtra","The ideal candidate will have hands-on experience in designing, building, and maintaining large-scale data processing systems and will be comfortable working…",EmployerActive 3 days ago,"₹60,000 - ₹2,00,000 a month",2023-08-30,https://in.indeed.com/company/Brainfloss-Private-Limited/jobs/Data-Engineer-12f0c6d57b2a8926?fccid=00c3c392b24cb201&vjs=3
193,Machine Learning Engineer- II,Machine Learning Engineer,General Mills,"Remote in Mumbai, Maharashtra","General Mills, Digital and Technology India, is seeking Sr Machine Learning Engineer to join the Enterprise Data Capabilities Organization.",PostedPosted 30+ days ago,?,2023-08-30,https://in.indeed.com/rc/clk?jk=4fcb293602740831&fccid=3bcf7eb192e678e4&vjs=3
194,Machine Learning Expert,Machine Learning Engineer,nslhub,"Hyderabad, Telangana","Develop and integrate deep learning algorithms for transfer learning (Simulated< =>Real Data), and end-to-end reinforcement learning for control.",PostedPosted 30+ days ago,?,2023-08-30,https://in.indeed.com/rc/clk?jk=bda20cdd083ad399&fccid=3a2540cc3d0e76ae&vjs=3
195,AI Engineer,Machine Learning Engineer,Kore.ai,"Hyderabad, Telangana","Solid understanding of ML algorithms, such as deep learning, decision trees, clustering, and regression.
Collaborate with cross-functional teams to understand…",PostedPosted 13 days ago,?,2023-08-30,https://in.indeed.com/rc/clk?jk=45c801e1760bf555&fccid=f7f06a3b2e3a0f7c&vjs=3
196,AI Engineer,Machine Learning Engineer,Firstventure Corporation,"Nariman Point, Mumbai, Maharashtra","Work with other machine learning engineers, data engineers, and AI engineers to develop machine learning models.
Experience with machine learning algorithms.",PostedPosted 30+ days ago,?,2023-08-30,https://in.indeed.com/rc/clk?jk=ab7b6fc66c19f6de&fccid=4a97645f66cef431&vjs=3
197,Statistics -Data Analyst,Machine Learning Engineer,Algowire Trading Technologies pvt .ltd,"Noida, Uttar Pradesh","Strong mathematical abilities, including linear algebra, calculus, probability.
Expertise in applied and theoretical statistics.
Total work: 1 year (Preferred).",EmployerActive 11 days ago,"₹3,00,000 - ₹12,00,000 a year",2023-08-30,https://in.indeed.com/company/Algowire-Trading-Technologies-pvt-.ltd/jobs/Statistical-Analyst-2f152bce1149ac4b?fccid=049bd812c775b78c&vjs=3
198,Data Science Intern,Machine Learning Engineer,Innomatics Research Labs,"Hyderabad, Telangana","Understanding of machine-learning and data science life cycle.
Expert knowledge of Python and Python libraries responsible for Data Analysis, Machine Learning…",EmployerActive 2 days ago,"Up to ₹2,40,000 a year",2023-08-30,https://in.indeed.com/company/Innomatics-Research-Labs/jobs/Data-Science-Intern-9147b02a64735375?fccid=12c8cee80e07dac8&vjs=3
