,title,job_role,companyName,job_location,Job_Summary,post_date,salary,today_date,Job_url
65,Python/Machine Learning Developer,Machine Learning Engineer,Infinnium Infotech,"Ahmedabad, Gujarat","Your responsibilities will evolve designing and constructing sophisticated machine learning models, as well as refining and updating existing systems.",EmployerActive 2 days ago,"₹2,00,000 - ₹7,00,000 a year",2023-08-30,https://in.indeed.com/company/Infinnium-infotech/jobs/Python-Developer-72d4b6da36a403e1?fccid=cb10ddfd40019914&vjs=3
66,Machine Learning Specialist for Intelligent Automation,Machine Learning Engineer,Bosch Group,"Bengaluru, Karnataka","Design and develop machine learning models and algorithms tailored to the specific needs, ensuring scalability, accuracy, and reliability.",PostedPosted 11 days ago,?,2023-08-30,https://in.indeed.com/rc/clk?jk=831894bfe5dbd074&fccid=a2faf1301ac6ad4b&vjs=3
67,Sr Data Scientist - Matching Science,Machine Learning Engineer,Indeed,Remote in Remote,"We are looking for someone with a deep interest in designing and building machine learning systems, thought-provoking assignments, is eager to learn, and wants…",EmployerActive 2 days ago,"₹49,60,000 - ₹74,40,000 a year",2023-08-30,https://in.indeed.com/company/Indeed/jobs/Senior-Data-Scientist-3f394558f770f877?fccid=d6ef41e202aa2c0b&vjs=3
68,Machine Learning Algorithm Engineer,Machine Learning Engineer,Ceremorphic,"Hyderabad, Telangana","Develop algorithms for deep learning, data analytics, machine learning, or scientific computing.
If you have a good understanding for deep learning and a strong…",PostedPosted 30+ days ago,?,2023-08-30,https://in.indeed.com/rc/clk?jk=2c68e8d991fcaac8&fccid=802be81faeefbe5e&vjs=3
69,DevOps Engineer,Machine Learning Engineer,Marktine Technology Solutions,Remote,"TECHNICAL SKILLS: • Experience in Public cloud development (AWS) & Cloud Services: AWS (EC2, S3, CloudWatch, RDS, Elastic Cache, IAM) • Configuration Management…",PostedPosted 30+ days ago,"₹10,00,000 - ₹12,00,000 a year",2023-08-30,https://in.indeed.com/rc/clk?jk=84c1f433dc667838&fccid=4d1ce2b52f6f8920&vjs=3
70,"Machine Learning Engineer - NLP, Agent Assist (Remote, India)",Machine Learning Engineer,Level AI,Remote in India,"Build post-deployment monitoring and continual learning capabilities.
Level AI is a Mountain View, CA-based startup innovating in the Voice AI space.",PostedPosted 30+ days ago,?,2023-08-30,https://in.indeed.com/rc/clk?jk=fc7eb6ae38b7005e&fccid=37768c08b7d91f8d&vjs=3
71,Machine Learning AI Platform Engineer,Machine Learning Engineer,Accenture,"Pune, Maharashtra+4 locations","Project Role Description :Develops applications and systems that utilize AI to improve performance and efficiency, including but not limited to deep learning,…",PostedPosted 8 days ago,?,2023-08-30,https://in.indeed.com/rc/clk?jk=876d14d376a77d04&fccid=a4e4e2eaf26690c9&vjs=3
72,Cloud Engineer Trainee,Machine Learning Engineer,G7 CR Technologies,"Bengaluru, Karnataka","Location: Kasturba Road, Bangalore, Karnataka.
CTC: As per market standards.
Experience: Min 0-1 Years.
Computer Science/BCA/MCA/B.E/B.",PostedPosted 30+ days ago,?,2023-08-30,https://in.indeed.com/rc/clk?jk=ed6765e19750de07&fccid=6927b259faf203db&vjs=3
73,Machine Learning Engineer,Machine Learning Engineer,NextSAA services,"Bengaluru, Karnataka","Machine learning: 2 years (Required).
The positions are on contract.
Hybrid model (work from the office).
Job Types: Full-time, Contractual / Temporary.",EmployerActive 9 days ago,?,2023-08-30,https://in.indeed.com/company/Nextsaa-services/jobs/Machine-Learning-Engineer-37f674c21c38f41f?fccid=4aa4c535f300dfb6&vjs=3
74,Machine Learning Engineer Bengaluru,Machine Learning Engineer,Minna Technologies,"Hybrid remote in Bengaluru, Karnataka","Experience building and maintaining scalable machine learning pipelines.
Opportunity to work with cutting-edge machine learning technologies.",PostedPosted 30+ days ago,?,2023-08-30,https://in.indeed.com/rc/clk?jk=99edff6efe56b904&fccid=7be3e73555d5389a&vjs=3
75,AI/ML Engineer,Machine Learning Engineer,Apping Technology,"Delhi, Delhi","Run machine learning tests and experiments.
Develop machine learning applications according to requirements.
Machine Learning Engineer responsibilities include…",PostedPosted 30+ days ago,?,2023-08-30,https://in.indeed.com/rc/clk?jk=a53979a6344e8460&fccid=cb196be5fd61661b&vjs=3
76,Senior Machine Learning Engineer,Machine Learning Engineer,Apollo.io,Remote,"Experience deploying and managing machine learning models in the cloud.
Experience with one or more of the following: natural language processing, deep learning…",PostedPosted 16 days ago,?,2023-08-30,https://in.indeed.com/rc/clk?jk=010883818ce3bfc3&fccid=3c23afd52cd89050&vjs=3
77,Machine Learning Engineer,Machine Learning Engineer,Careervira,"Gurgaon, Haryana","Experience modelling graph-based data structures.
Deployment, packaging, versioning of models.
Experiment design, A/B testing, performance measurement.",PostedPosted 30+ days ago,?,2023-08-30,https://in.indeed.com/rc/clk?jk=69e902014072d3a0&fccid=6de0bd88c4375347&vjs=3
78,Machine Learning Engineer,Machine Learning Engineer,DentalDost,"Pune, Maharashtra","1-3 years of demonstrated experience as machine learning engineer/data scientist.
Understanding of data pipelines for machine learning.",PostedPosted 30+ days ago,?,2023-08-30,https://in.indeed.com/rc/clk?jk=fa68ea00185ca6fd&fccid=940aaf30c6bfe3f1&vjs=3
79,Artificial Intelligence (AI) Engineer,Machine Learning Engineer,X-YUG Technologies Pvt Ltd,"Hyderabad, Telangana","Proven experience in designing and implementing machine learning and deep learning.
Research and Innovation: Stay current with the latest advancements in AI and…",EmployerActive 2 days ago,"Up to ₹1,00,000 a month",2023-08-30,https://in.indeed.com/company/X--YUG-Technologies-Pvt-Ltd/jobs/Business-Intelligence-Developer-0089f3dec051fdff?fccid=278b1c3d2e06cadf&vjs=3
80,ML/AI Engineer,Machine Learning Engineer,IIE Network,"Bengaluru, Karnataka","Collaborate with software engineers to integrate machine learning models into production systems.
Proficiency in developing and deploying machine learning…",Hiring ongoing,"Up to ₹36,00,000 a year",2023-08-30,https://in.indeed.com/company/IIE-Network/jobs/Engineer-30f843be01ba1430?fccid=6609afceff987ced&vjs=3
81,Backend Engineer,Machine Learning Engineer,BigShyft,"Remote in Bengaluru, Karnataka","What makes you a great fit:
Proficient knowledge of programming in Python - strong understanding of data structures Proficient knowledge of back-end frameworks…",PostedPosted 14 days ago,"₹7,00,000 - ₹9,50,000 a year",2023-08-30,https://in.indeed.com/rc/clk?jk=4b80392671dd221c&fccid=df4303b9957be85e&vjs=3
82,AVP Fair Lending Analytics,Machine Learning Engineer,4bell Technology,Remote in Remote,* Support the implementation of the SYF Fair Lending Disparate Impact Testing Framework by generating data and/or providing 2nd line oversight of data needed to…,EmployerActive 2 days ago,"₹20,00,000 - ₹25,00,000 a year",2023-08-30,https://in.indeed.com/company/4Bell-Technology/jobs/Assistant-Vice-President-555dc97864fd6e2e?fccid=796a5f1c8bee66df&vjs=3
83,Machine Learning Engineer,Machine Learning Engineer,JForce Solutions,"Vile Parle, Mumbai, Maharashtra",Proficiency in machine learning frameworks (like Keras or PyTorch) and libraries (like scikit-learn or pandas).,PostedPosted 30+ days ago,?,2023-08-30,https://in.indeed.com/rc/clk?jk=da426822ee29c20b&fccid=91080e992f106c9e&vjs=3
84,Data Scientist (Machine Learning),Machine Learning Engineer,TechStep,"Hadapsar, Pune, Maharashtra",Deep knowledge of various predictive modeling and machine learning algorithms and underlying Maths and Stats behind them.,PostedPosted 30+ days ago,?,2023-08-30,https://in.indeed.com/rc/clk?jk=11192ca6b24a25da&fccid=fc3782405cd7206a&vjs=3
85,AI/Machine Learning Engineer,Machine Learning Engineer,AssetOne,"Pune, Maharashtra","Deep understanding of statistics and experience with machine learning algorithms/techniques.
Experience is build & deploy machine-learning models at scale on…",PostedPosted 30+ days ago,?,2023-08-30,https://in.indeed.com/rc/clk?jk=cb51f18d894cec9a&fccid=79a6848df3604524&vjs=3
86,Data Analytics Intern,Machine Learning Engineer,Ketto,"Mumbai, Maharashtra","Good to have: Knowledge of Python/R + basic understanding of statistical testing & machine learning concepts (regressions, decision trees, clustering.",PostedPosted 19 days ago,?,2023-08-30,https://in.indeed.com/rc/clk?jk=5fcafca2544f79a8&fccid=0ca5fb09be5db2e4&vjs=3
87,Data Engineer,Machine Learning Engineer,Coinfluence,"Remote in Pune, Maharashtra","Create and maintain optimal and scalable data pipeline architecture.
Enhance the infrastructure required for optimal extraction, transformation, and loading of…",Hiring ongoing,"Up to ₹13,00,000 a year",2023-08-30,https://in.indeed.com/company/Coinfluence/jobs/Data-Engineer-73d97d4c82132fc9?fccid=3658618975d064e3&vjs=3
88,Machine Learning Engineer,Machine Learning Engineer,PinnacleWorks Infotech,"Gurgaon, Haryana","Train & tune Automated speech recognition (ASR) models.
Enhance existing models used in production settings.
Ability to read recent ML research papers and adapt…",PostedPosted 23 days ago,?,2023-08-30,https://in.indeed.com/rc/clk?jk=b2e2fdae990402d4&fccid=bc57d091bd67dc3a&vjs=3
89,Machine Learning Engineer,Machine Learning Engineer,Workday,"Remote in Pune, Maharashtra","Experience in the Databricks, AWS,(RedShift, Sagemaker) H2O, , MySQL, Spark and associated tools to build scalable machine learning systems.",PostedPosted 30+ days ago,?,2023-08-30,https://in.indeed.com/rc/clk?jk=798c5e3e69be3ad3&fccid=9ac45d217f8342a1&vjs=3
90,Engineer - Aerodynamics,Machine Learning Engineer,Airbus,"Bengaluru, Karnataka","Overall understanding of data analytics, Machine learning.
It is part of Flight Physics Department within Airbus India Engineering.",PostedPosted 30+ days ago,?,2023-08-30,https://in.indeed.com/rc/clk?jk=e0ebf2dbbcfc175b&fccid=2d0740e02e80cf22&vjs=3
91,Machine Learning Engineers,Machine Learning Engineer,Inavan India Technologies,"Kochi, Kerala","Looking forexperienced people specifically in the field of computer vision, image processing & ML/DL architectures and algorithms.",PostedPosted 30+ days ago,?,2023-08-30,https://in.indeed.com/rc/clk?jk=1a5c6f78e52605d9&fccid=43377f9ad8e67c87&vjs=3
92,Machine Learning Engineer,Machine Learning Engineer,MNJ Software,Remote,"Experience of machine learning Algorithms and Libraries.
Experience with machine learning platforms such as Microsoft Azure, Google Cloud, IBM Watson and Amazon…",PostedPosted 30+ days ago,?,2023-08-30,https://in.indeed.com/rc/clk?jk=051bd6383dd1f0df&fccid=eed7c45ec44b6a0b&vjs=3
93,Dev Ops Engineer/Consultant,Machine Learning Engineer,True Data Software,Remote,"Looking for a DevOps Engineer with 1+ years of experience in working with container tools like Docker, Jenkins and Kubernetes.",PostedPosted 30+ days ago,?,2023-08-30,https://in.indeed.com/rc/clk?jk=c36d9b1d24f41518&fccid=905889db10428b23&vjs=3
94,AI & MACHINE LEARNING Manager (SENIOR LEVEL),Machine Learning Engineer,eigital - redefining digital,Remote in Remote,"Run machine learning tests and experiments.
Develop machine learning applications according to requirements.
Study and transform data science prototypes.",EmployerActive 2 days ago,"₹40,000 - ₹80,000 a month",2023-08-30,https://in.indeed.com/company/eigital---redefining-digital/jobs/Machining-Manager-0144e816c31650e0?fccid=559516016dc3903f&vjs=3
95,Machine Learning Engineer,Machine Learning Engineer,TAC Security,"Bengaluru, Karnataka",— Ensures software applications are built with quality while conforming to corporate and regulatory processes and practices by.,PostedPosted 30+ days ago,?,2023-08-30,https://in.indeed.com/rc/clk?jk=c0f6d9481abec5cf&fccid=b3f5c3dd1fcc6cba&vjs=3
96,AI/ML Engineer,Machine Learning Engineer,Mindfire Solutions,"Delhi, Delhi","Solid theoretical understanding of machine learning.
Develop, validate, and implement machine learning models and algorithms.",PostedPosted 19 days ago,?,2023-08-30,https://in.indeed.com/rc/clk?jk=38ae70f94af67634&fccid=5beecbf9b1fcfd6f&vjs=3
97,Computer Vision Research Engineer - Machine Learning,Machine Learning Engineer,Mercedes-Benz Research and Development India...,"Bengaluru, Karnataka","Demonstrated past algorithm development in at least one area within machine learning like neural networks, clustering, object tracking.",PostedPosted 30+ days ago,?,2023-08-30,https://in.indeed.com/rc/clk?jk=61344444b87ca46d&fccid=9ab138c02aaca829&vjs=3
98,Data Scientist,Machine Learning Engineer,Glowfin,"Delhi, Delhi","O Hands on exposure of machine learning model development using tools and technologies such as R, Python, Azure.
Total work: 4 years (Preferred).",EmployerActive 2 days ago,"₹12,00,000 - ₹15,00,000 a year",2023-08-30,https://in.indeed.com/company/Glowfin/jobs/Data-Scientist-ed663645829cc7e8?fccid=e2c59b709fd685fc&vjs=3
99,Data Engineer - Azure,Machine Learning Engineer,Mercedes-Benz Research and Development India...,"Bengaluru, Karnataka","We focus on topics ranging from computer-aided design and simulations (CAD, CAE) for powertrain, chassis and exteriors to embedded systems, telematics and…",PostedPosted 30+ days ago,?,2023-08-30,https://in.indeed.com/rc/clk?jk=0dce0ebbb2c891af&fccid=9ab138c02aaca829&vjs=3
100,Data Science,Machine Learning Engineer,Ellicium,"Pune, Maharashtra","Providing continuous learning and development opportunities, unlocking your full potential.
We enable business transformation through Big Data, Analytics,.",PostedPosted 14 days ago,?,2023-08-30,https://in.indeed.com/rc/clk?jk=97355541c3eee158&fccid=5d91cffe85c9b371&vjs=3
101,Data Engineer,Machine Learning Engineer,Uvation,"Remote in Delhi, Delhi","As a Data Engineer, you will be responsible for designing, developing, and maintaining the data architecture, data management systems, and data processing…",PostedPosted 30+ days ago,?,2023-08-30,https://in.indeed.com/rc/clk?jk=a2a8ecd3bd9ed8aa&fccid=ade7c615896d91f4&vjs=3
102,Staff Machine Learning Engineer,Machine Learning Engineer,Intercontinental Exchange,"Remote in Pune, Maharashtra","Excellent understanding of machine learning techniques and algorithms, such as k-NN, Naive Bayes, SVM, Decision Forests, Neural Networks, etc.",PostedPosted 30+ days ago,?,2023-08-30,https://in.indeed.com/rc/clk?jk=400132ddf3beb5a1&fccid=306f81e1483f7d82&vjs=3
103,Machine Learning Compiler Engineer,Machine Learning Engineer,Ceremorphic,"Hyderabad, Telangana","Experience working with high level machine learning frameworks (Tensorflow, PyTorch, MXNet).
Knowledge of the machine learning hardware accelerator space (basic…",PostedPosted 30+ days ago,?,2023-08-30,https://in.indeed.com/rc/clk?jk=d9eb1dc703300308&fccid=802be81faeefbe5e&vjs=3
104,Artificial Intelligence Intern,Machine Learning Engineer,Von Services,"Kochi, Kerala","Familiarity with popular machine learning frameworks.
Strong understanding of machine learning concepts, algorithms, and training techniques.",EmployerActive 8 days ago,"₹30,000 - ₹40,000 a month",2023-08-30,https://in.indeed.com/company/G-Plus-Enterprises/jobs/Business-Intelligence-Analyst-Intern-6b79daa0eb95a631?fccid=4e84a4a81c8299b9&vjs=3
105,Manager - EmTech - Machine Learning - MC Analytics - Mumbai/Bangalore,Machine Learning Engineer,PwC,"Mumbai, Maharashtra","Quickly test and reject hypotheses around data processing and machine learning model building.
Build machine learning pipelines that ingest, clean data, and…",PostedPosted 30+ days ago,?,2023-08-30,https://in.indeed.com/rc/clk?jk=a8655aa79c60c21a&fccid=5e964c4afc56b180&vjs=3
106,Data Engineer,Machine Learning Engineer,Crypto Mize,"Delhi, Delhi","After formulating a set of dataset processes, data engineers store optimized data.
Data engineers dive into data and pinpoint tasks where manual participation…",PostedPosted 30+ days ago,?,2023-08-30,https://in.indeed.com/rc/clk?jk=47c4e7b53a0d6201&fccid=bdad58a8df3ba8a4&vjs=3
107,Snowflake Data Engineer,Machine Learning Engineer,KPMG,"Gurgaon, Haryana","Lighthouse, KPMG’s Big Data, AI & Analytics practice has deep industry specialization and focuses on solution delivery for Data Engineering, Data Science, Data…",PostedPosted 30+ days ago,?,2023-08-30,https://in.indeed.com/rc/clk?jk=31bae13337b99322&fccid=2dd390c3a48a7ed0&vjs=3
108,Project Manager (Cloud) Immediate Joiners Preferred ONLY,Machine Learning Engineer,Alcor Solutions Inc.,Remote in Remote,"Alcor Solutions is hiring a Cloud Project Manager with 8+ years of experience.
This is 100% remote opportunity.
We are looking for immediate joiners.",EmployerActive 21 days ago,"Up to ₹30,00,000 a year",2023-08-30,https://in.indeed.com/company/Alcor-Solutions-Inc./jobs/Joiner-7ce7500c0a23eea8?fccid=4b26885231670e01&vjs=3
109,Database Developers,Machine Learning Engineer,OmnePresent,"Remote in Pune, Maharashtra","For onboarding, you will have to sign a 2.5 years’ service agreement with the company.
CANDIDATE SHOULD BE OPEN TO LEARNING AND WORKING ON NEW TECHNOLOGIES.",PostedPosted 30+ days ago,?,2023-08-30,https://in.indeed.com/rc/clk?jk=51ea5b022ad2274c&fccid=39ab39ae0c9e0484&vjs=3
110,Machine learning engineer,Machine Learning Engineer,3loq,"Hyderabad, Telangana","0-2 years of machine learning experience.
Machine learning, Data analysis, Statistics & Probability.
Checking data from every stage and every base for assigned…",PostedPosted 30+ days ago,?,2023-08-30,https://in.indeed.com/rc/clk?jk=73ca5af92b87983b&fccid=4722bb04fac998c7&vjs=3
111,Data Science Engineer,Machine Learning Engineer,F(x) Data Labs PVT LTD,"Ahmedabad, Gujarat","Knowledge of a variety of machine learning techniques (clustering, decision tree learning, artificial neural networks, etc.) and their real-world advantages…",EmployerActive 6 days ago,"₹5,00,000 - ₹7,00,000 a year",2023-08-30,https://in.indeed.com/company/F(x)-Data-Labs-PVT-LTD/jobs/Data-Scientist-c4fcfe27e21d047c?fccid=62074cabcc5c06e0&vjs=3
112,Machine Learning/Artificial Intelligence,Machine Learning Engineer,Code Tree Software Solutions,"Vijayawada, Andhra Pradesh","Responsible for artificial intelligence/machine learning technology and application analysis, understand latest industrial and academic developments in AI/ML.",PostedPosted 30+ days ago,?,2023-08-30,https://in.indeed.com/rc/clk?jk=170fbd47759aca33&fccid=3d61e324cd2c1543&vjs=3
113,Machine Learning Engineer,Machine Learning Engineer,PayPal,"Bengaluru, Karnataka+1 location","Ideal candidate will have a strong background in developing and implementing machine learning algorithms.
This team leverages state of the art machine learning…",PostedPosted 11 days ago,?,2023-08-30,https://in.indeed.com/rc/clk?jk=85fd57988dcf0802&fccid=978d9fd9799d55a8&vjs=3
114,Junior Frontend Engineer,Machine Learning Engineer,Clarifai,"Remote in Bengaluru, Karnataka","You may collaborate with other members of our team, include the backend, infrastructure, and applied machine learning engineers, designers, and product managers…",PostedPosted 30+ days ago,?,2023-08-30,https://in.indeed.com/rc/clk?jk=fa10b9e4ee1727da&fccid=0bfd6b75d98e7714&vjs=3
115,Backend Engineer (Gurgaon),Machine Learning Engineer,Tealfeed,"Gurgaon, Haryana","We believe that the internet can be a better learning place by providing creators with the right tools and support.
What you’ll be doing:
Who we’re looking for:",PostedPosted 21 days ago,"₹12,00,000 - ₹18,00,000 a year",2023-08-30,https://in.indeed.com/rc/clk?jk=e7ada3ad5ec99c97&fccid=318044dbb8281914&vjs=3
116,Data Scientist,Machine Learning Engineer,Stemly Pte Ltd,Remote,"The ideal candidate will be a talented data scientist, adept at machine learning and/or applied statistics with strong foundations in computer science…",PostedPosted 15 days ago,?,2023-08-30,https://in.indeed.com/rc/clk?jk=53aee2c06387a78f&fccid=209ba9c4e9365bc4&vjs=3
117,Database Developers,Machine Learning Engineer,OmnePresent,"Remote in Pune, Maharashtra","For onboarding, you will have to sign a 2.5 years’ service agreement with the company.
CANDIDATE SHOULD BE OPEN TO LEARNING AND WORKING ON NEW TECHNOLOGIES.",PostedPosted 30+ days ago,?,2023-08-30,https://in.indeed.com/rc/clk?jk=51ea5b022ad2274c&fccid=39ab39ae0c9e0484&vjs=3
118,Backend Engineer (Gurgaon),Machine Learning Engineer,Tealfeed,"Gurgaon, Haryana","We have recently launched several features such as newsletters, 1:1 connect sessions, and plan to provide creators with the entire ecosystem necessary to start…",PostedPosted 21 days ago,"₹12,00,000 - ₹18,00,000 a year",2023-08-30,https://in.indeed.com/rc/clk?jk=e7ada3ad5ec99c97&fccid=318044dbb8281914&vjs=3
119,Machine learning engineer,Machine Learning Engineer,3loq,"Hyderabad, Telangana","0-2 years of machine learning experience.
Machine learning, Data analysis, Statistics & Probability.
Checking data from every stage and every base for assigned…",PostedPosted 30+ days ago,?,2023-08-30,https://in.indeed.com/rc/clk?jk=73ca5af92b87983b&fccid=4722bb04fac998c7&vjs=3
120,Data Engineer - Azure,Machine Learning Engineer,Mercedes-Benz Research and Development India...,"Bengaluru, Karnataka","We focus on topics ranging from computer-aided design and simulations (CAD, CAE) for powertrain, chassis and exteriors to embedded systems, telematics and…",PostedPosted 30+ days ago,?,2023-08-30,https://in.indeed.com/rc/clk?jk=0dce0ebbb2c891af&fccid=9ab138c02aaca829&vjs=3
121,Machine Learning Engineer,Machine Learning Engineer,Tapaya Technologies,"Calicut, Kerala","Looking for developers with experience in machine learning specifically in NLP.
Familiarity with python ML libraries.
Specific experience in NLP tasks.",EmployerActive 2 days ago,"₹8,000 - ₹25,000 a month",2023-08-30,https://in.indeed.com/company/Tlabz/jobs/Machine-Learning-Engineer-8f506e1436d0d40f?fccid=071d381abfb7b7a1&vjs=3
122,Junior Software Engineer- Frontend,Machine Learning Engineer,Zuma,"Bengaluru, Karnataka","Zuma makes an automated sales agent that converses with 100% of inbound leads, ultimately improving the way consumers interact with businesses and organizations…",PostedPosted 15 days ago,?,2023-08-30,https://in.indeed.com/rc/clk?jk=2a002bbdf23c95f4&fccid=337a0fb6be987a37&vjs=3
123,Support Engineer,Machine Learning Engineer,Propel Technology Group,"Chennai, Tamil Nadu","As an IT Support Engineer at Propel, you will play a crucial role in providing technical assistance and support to our internal and external users.",PostedPosted 30+ days ago,?,2023-08-30,https://in.indeed.com/rc/clk?jk=41635bee7e3e9cbf&fccid=baeb7da83994f0bc&vjs=3
124,Children's Book Illustrator,Machine Learning Engineer,K2Hub,"Remote in Bengaluru, Karnataka","Proven illustration skills, with a portfolio demonstrating your abilities (experience with children's book illustration is a plus but not required).",PostedPosted 30+ days ago,"₹35,000 - ₹45,000 a month",2023-08-30,https://in.indeed.com/company/K2Hub/jobs/Illustrator-75c6ed423d92753b?fccid=dac98fca20b53cb4&vjs=3
125,Python Developer,Machine Learning Engineer,Capital Numbers Infotech,Remote,We offer opportunities to take ownership of the full development life-cycle where you will be expected to manage and deliver projects on time and to a high…,PostedPosted 30+ days ago,"Up to ₹22,00,000 a year",2023-08-30,https://in.indeed.com/rc/clk?jk=c7369003c499f0d7&fccid=d367bcc2eb80486a&vjs=3
126,Machine Learning Engineer,Machine Learning Engineer,Cientra Techsolution,"Bengaluru, Karnataka","Excellent quantitative skills and experience in statistics and machine learning.
Interest in learning and applying the learnings to achieve the objectives.",PostedPosted 30+ days ago,?,2023-08-30,https://in.indeed.com/rc/clk?jk=b48dfd14cb030894&fccid=ce8c7a399b802ebe&vjs=3
127,Machine Learning Lead Developer (Gen AI),Machine Learning Engineer,EY,"Thiruvananthapuram, Kerala","Relevant Experience of 2+ year and total experience in software development 6+.
Proven experience as a Machine Learning Engineer or similar role, minimum of 1…",PostedPosted 13 days ago,?,2023-08-30,https://in.indeed.com/rc/clk?jk=fc3a18e04533fdbb&fccid=1544766d4c2915b0&vjs=3
128,Data Engineer - Machine Learning/Data Science,Machine Learning Engineer,GLOBALFOUNDRIES,"Bengaluru, Karnataka","Understanding of advanced data analytics and machine learning.
Experience deploying advanced data analytics and machine learning applications.",PostedPosted 8 days ago,?,2023-08-30,https://in.indeed.com/rc/clk?jk=95cc0fb0d53e88bf&fccid=6a2e5a5f89491e88&vjs=3
129,Engineer - Data Science (DATA SCIENCE ENGINEER),Machine Learning Engineer,Ninestars Information Technologies,"Bengaluru, Karnataka",Tech/MCA/MSC - Computer Science/IT/Data Science/Machine Learning/Deep Learning/Artificial Intelligence Engineering (1st Division).,PostedPosted 30+ days ago,?,2023-08-30,https://in.indeed.com/rc/clk?jk=9b271a236e485b91&fccid=0f52fcdc20bbd3dd&vjs=3
130,Trainee Software Engineer,Machine Learning Engineer,ScaleReal Technologies,Remote,"Remote, India/Pune | Full time | 0 - 1 years of Experience.
Writing Clean, Readable, Testable, and Reusable Code.
Basic TDD, unit test, and debugging skills.",PostedPosted 30+ days ago,?,2023-08-30,https://in.indeed.com/rc/clk?jk=f1018a3c8b51a2f9&fccid=4f0e91f8e6cb0371&vjs=3
131,AI/ML Intern,Machine Learning Engineer,EY,"Kochi, Kerala","Desire to have completed training on Python programming with machine learning concepts.
Learn and develop solutions using AI ML technologies with Python, Azure…",PostedPosted 30+ days ago,?,2023-08-30,https://in.indeed.com/rc/clk?jk=f31a6bc4e532127d&fccid=1544766d4c2915b0&vjs=3
